Type,Id,Token,Speaker
Morpheme,184#00:41:44#0,他にも呼び名が確認されてるところで言うとですね,
Morpheme,184#00:41:47#0,小熊座とかサソリ座とかも二つ星と呼ばれる組み合わせがあったり,
Morpheme,184#00:41:51#0,あとみんな大好き織姫と彦星も二つ星と呼ばれる地域があったり,
Morpheme,184#00:41:55#0,遠いけどね,
Morpheme,184#00:41:57#0,正直ね星が二つ並んでたらそれは二つ星です,
Morpheme,184#00:42:01#0,なるほど二つ星です,
Morpheme,184#00:42:03#0,というわけでね,
Morpheme,184#00:42:05#0,やっつけさんが強いかもしんないですけど,
Morpheme,184#00:42:08#0,これは逆に潔くない,
Morpheme,184#00:42:11#0,潔くないですか,
Morpheme,184#00:42:12#0,潔いと思います,
Morpheme,184#00:42:13#0,我々もね一生の日本人に習っていきたいなと思います,
Morpheme,184#00:42:18#0,無理にね取り繕ったりせずに,
Morpheme,184#00:42:21#0,小熊とか作らずに,
Morpheme,184#00:42:22#0,見たまんまの姿で生きていきましょうという,
Morpheme,184#00:42:25#0,太古の日本人からのメッセージが,
Morpheme,184#00:42:27#0,この二つの星に求められています,
Morpheme,184#00:42:29#0,なにいきなり人生訓始まった,
Morpheme,184#00:42:32#0,無理やりじゃない,
Morpheme,184#00:42:34#0,無理やり話を反らして何とか納得させたいような演出にしようという,
Morpheme,184#00:42:39#0,根担ですということを今潔く言いました,
Morpheme,184#00:42:43#0,なに声のボリュームで納得させてこようとしてるの,
Morpheme,184#00:42:47#0,大変失礼いたしました,
Morpheme,184#00:42:49#0,というわけでですね,
Morpheme,184#00:42:51#0,今回は個人的に形に納得のいかない星座と,
Morpheme,184#00:42:55#0,それかある程度納得できる星座分類して,
Morpheme,184#00:42:58#0,クイズ形式で紹介してみました,
Morpheme,184#00:43:01#0,結構ギリシャ神話関連のところについてはね,
Morpheme,184#00:43:04#0,ひどいこと言ったんですけど,
Morpheme,184#00:43:07#0,若干ね仕方ないなっていう擁護できる要素がありまして,
Morpheme,184#00:43:14#0,日本って特に外部の星を見る文化が入ってくることって,
Morpheme,184#00:43:19#0,なかなかなかったわけなんですよね,
Morpheme,184#00:43:21#0,外部の星ってどういうこと,
Morpheme,184#00:43:23#0,外の国の文化として,
Morpheme,184#00:43:25#0,中国からある程度入ってきてはいるとは思うんですけれども,
Morpheme,184#00:43:29#0,日本独自の文化でずっといっちゃってると思うんですね,
Morpheme,184#00:43:34#0,日本の星の呼び方っていうのは,
Morpheme,184#00:43:36#0,西洋のものっていうのが出てくるのはすごいどっちの方ですもんね,
Morpheme,184#00:43:40#0,そうですね,
Morpheme,184#00:43:41#0,逆にギリシャではそもそももともとある程度,
Morpheme,184#00:43:45#0,神話体系が確立されてしまっているところに,
Morpheme,184#00:43:48#0,メソポタミアの方から星を見る文化っていうのが入ってきちゃってて,
Morpheme,184#00:43:54#0,これらを頑張って結びつけようとした結果の,
Morpheme,184#00:43:57#0,カニ座だったりするんだと思うんですね,
Morpheme,184#00:44:01#0,なるほどなるほど,
Morpheme,184#00:44:02#0,神話がもう起源前とかからある状態で星を見る文化が入ってきたから,
Morpheme,184#00:44:07#0,合わせてみちゃえっていう,
Morpheme,184#00:44:10#0,その2つをまとめた結果かなりこじつけっぽいものが多くなったんだろうなと,
Morpheme,184#00:44:15#0,ちなみに日本では星を見る文化自体はあった?,
Morpheme,184#00:44:19#0,そうですね,
Morpheme,184#00:44:20#0,星を見る文化自体はあって,
Morpheme,184#00:44:22#0,例えばカシオペア座ってわかりますかね,
Morpheme,184#00:44:25#0,北の方にいる,
Morpheme,184#00:44:26#0,W字のやつなんですけど,
Morpheme,184#00:44:27#0,あれとかも怒り星とか呼ばれてたりして,
Morpheme,184#00:44:30#0,結構ね漁業文化とか農業文化とかに根付いた星のネーミングとかも,
Morpheme,184#00:44:35#0,じゃあ割と自分たちの生活に基づいたものをつけがちなんですね日本人ってのは,
Morpheme,184#00:44:40#0,神話と日本にも神話ありますけどあれとは結びつけると思わなかったですね,
Morpheme,184#00:44:44#0,そうですねあんまり日本神話と星っていうのは結びつき少ないものになってますね,
Morpheme,184#00:44:48#0,なんでなんでしょう,
Morpheme,184#00:44:49#0,確かにそこら辺の文化の違いに関してはまた文化系詳しい人に聞いた方がいいかと思いますので,
Morpheme,184#00:44:54#0,ちょっと僕の範疇からはそれるかなとは思うんですけれども,
Morpheme,184#00:44:58#0,なんでねそこら辺また文化系のことに詳しい人それこそね,
Morpheme,184#00:45:03#0,民族学ラジオの黒川さんとかをここに置いて喋る機会があったら面白いだろうなと,
Morpheme,184#00:45:09#0,そうですねちょっといろいろ混ぜたら面白そうですよね聞いてみたい普通に,
Morpheme,184#00:45:14#0,文化系のことで言うとねそれこそゆるがくとハウスの時にも黒川さんから一個オリオン座の面白い話の話っていうのを聞いているので,
Morpheme,184#00:45:23#0,よかったらそっちも見ていただければなと,
Morpheme,184#00:45:25#0,聞きたい,
Morpheme,184#00:45:26#0,思います,
Morpheme,184#00:45:27#0,というわけでね古代ギリシャ人は星をね空を見るのを面白くするために頑張ってくれたんですよ,
Morpheme,184#00:45:35#0,なるほど,
Morpheme,184#00:45:36#0,ギリシャ神話と結びつけることによってみんなにねこういう星にも興味を持ってもらおうという根担が見受けられるのでこれは努力の結果こうなった,
Morpheme,184#00:45:45#0,努力の結晶だったんですねカニに足が一本ないのも,
Morpheme,184#00:45:49#0,そう,
Morpheme,184#00:45:50#0,その,
Morpheme,184#00:45:51#0,そうです努力の結果の足の欠片,
Morpheme,184#00:45:55#0,足の欠片 弟子が頭だけなのも,
Morpheme,184#00:45:57#0,なるほど,
Morpheme,184#00:45:59#0,そう頑張った結果なってます,
Morpheme,184#00:46:01#0,だから彼らのおかげで今の我々は空を見ることを楽しめているといっても過言ではない,
Morpheme,184#00:46:07#0,それは過言だけど,
Morpheme,184#00:46:08#0,そうなので彼らの努力の成果を笑ったりしちゃいけませんよ,
Morpheme,184#00:46:12#0,私笑ってないよだってなんなら越山君が怒ってるのに対して納得できるけどなって言ってましたからね,
Morpheme,184#00:46:18#0,僕が悪かったです,
Morpheme,184#00:46:20#0,見えそうただの一本線が越山だとか言われてもみんな頑張ってくれたんだなと思ってあの星たちに思いを馳せましょう,
Morpheme,184#00:46:31#0,思いを馳せて夜空を見上げましょう,
Morpheme,184#00:46:33#0,というお話でございました今回もありがとうございました結構ねあのいろんな星の話をしたのでこの星の話詳しく聞きたいとか神話関連のこともっと聞いてみたいみたいな星のことがありましたらぜひコメント欄に残していただければと思います,
Morpheme,184#00:46:49#0,我々は逐一チェックしますね,
Morpheme,184#00:46:51#0,そうですね皆さんの興味ある星座なんだろうって星の字書いてこう,
Morpheme,184#00:46:55#0,そうですね,
Morpheme,184#00:46:57#0,というわけで今回も終わりにしましょう,
Morpheme,184#00:46:59#0,ありがとうございました,
Morpheme,185#00:00:00#0,【コメント】クルカくん、前回大工の話したけどさ,
Morpheme,185#00:00:04#0,しましたね,
Morpheme,185#00:00:05#0,うん、あれからちゃんと聞いてきた?,
Morpheme,185#00:00:07#0,あれから?,
Morpheme,185#00:00:09#0,んー、これ言っちゃっていいのかもしれないですけど,
Morpheme,185#00:00:11#0,2時間前ですよね,
Morpheme,185#00:00:13#0,あれ、2時間あったら聞けたんじゃん,
Morpheme,185#00:00:15#0,あ、まあ言ってみれば1時間の曲だから聞けるには聞けるけど,
Morpheme,185#00:00:19#0,その間何してたか覚えてますか?,
Morpheme,185#00:00:21#0,ご飯食べたよね,
Morpheme,185#00:00:22#0,ねー,
Morpheme,185#00:00:23#0,聞かなかったねー,
Morpheme,185#00:00:25#0,そうだねー,
Morpheme,185#00:00:26#0,まあね、ちょっとね,
Morpheme,185#00:00:28#0,いよいよ今年も終わりっていうことで,
Morpheme,185#00:00:32#0,クルカくんをはじめ、リスナーの皆さんにもね,
Morpheme,185#00:00:35#0,ぜひこのベートーベンの大曲第9番,
Morpheme,185#00:00:37#0,大工を聞いてから1年を終えてもらいたいと思ってるんだよ,
Morpheme,185#00:00:42#0,1時間ちょっとで聞き終わるからね,
Morpheme,185#00:00:45#0,まあでもね、せっかく聞くんだったら,
Morpheme,185#00:00:48#0,その、やっぱり楽しみどころっていうのが分かってた方がいいじゃない?,
Morpheme,185#00:00:51#0,そのもちろんですね,
Morpheme,185#00:00:53#0,だから今回これを聞けば,
Morpheme,185#00:00:56#0,リスナーさんもね、もう大工は任せなさいよと,
Morpheme,185#00:01:00#0,私は楽しみどころ知ってるんだぞと,
Morpheme,185#00:01:03#0,そんな風にね、大工痛になれるお話を,
Morpheme,185#00:01:06#0,今日ね、大音楽賞だけ持ってきたんで,
Morpheme,185#00:01:08#0,大工痛ね,
Morpheme,185#00:01:09#0,もうちょっと頭の中でどっちらかで始めちゃったよもう,
Morpheme,185#00:01:13#0,げんさんが出てきたんですよ,
Morpheme,185#00:01:15#0,いやいやいや,
Morpheme,185#00:01:16#0,痛みってこと?,
Morpheme,185#00:01:17#0,痛の大工,
Morpheme,185#00:01:18#0,痛の大工、そういうことか,
Morpheme,185#00:01:20#0,いやいやそうじゃなくてね,
Morpheme,185#00:01:21#0,工業局第9番、大工痛になれるね、あの話を持ってきたので,
Morpheme,185#00:01:26#0,今日はね、ぜひ聞いていただきたいかなと思います,
Morpheme,185#00:01:29#0,楽しみに聞かせてもらいます,
Morpheme,185#00:01:32#0,でね、今日はね、鍵盤ハーモニクを持ってきたから,
Morpheme,185#00:01:35#0,鍵盤ハーモニク、懐かしいな,
Morpheme,185#00:01:37#0,説明していくよ,
Morpheme,185#00:01:38#0,言葉の響きもそうだけど音の響きも多分懐かしいやつっすね,
Morpheme,185#00:01:42#0,うわー出た,
Morpheme,185#00:01:44#0,ちょっと音鳴らしてみるよ,
Morpheme,185#00:01:48#0,懐かしい音鳴らすね,
Morpheme,185#00:01:50#0,これね、僕が教育実習の時に急いで買ったやつ,
Morpheme,185#00:01:55#0,だからピカピカなんだ,
Morpheme,185#00:01:56#0,そうそうそうそう,
Morpheme,185#00:01:57#0,あのね、もともと全然違う授業やる予定だったの,
Morpheme,185#00:02:01#0,授業?,
Morpheme,185#00:02:02#0,そう、ボディーパーカッション的な,
Morpheme,185#00:02:04#0,誰でも何もなくても楽しめる音楽の授業を作ろうと思ってたんだけど,
Morpheme,185#00:02:08#0,ちょうどね、その授業をするのが来週の月曜日ですっていうタイミングで,
Morpheme,185#00:02:14#0,その前の週の木曜日に,
Morpheme,185#00:02:16#0,その1年生の手元にね、鍵盤ハーモニクが届いちゃったの,
Morpheme,185#00:02:19#0,ん?,
Morpheme,185#00:02:20#0,手元に,
Morpheme,185#00:02:21#0,ほう,
Morpheme,185#00:02:22#0,だからもう普通にカリキュラムとして,
Morpheme,185#00:02:24#0,おーおーおー,
Morpheme,185#00:02:25#0,届いちゃったの,
Morpheme,185#00:02:26#0,で、僕音楽の先生として来てるわけ,
Morpheme,185#00:02:29#0,そうだよね,
Morpheme,185#00:02:30#0,で、鍵盤ハーモニク手にあるわけ,
Morpheme,185#00:02:31#0,使わざるを得ない,
Morpheme,185#00:02:32#0,これで僕がさ、はいじゃあ音楽の授業やります,
Morpheme,185#00:02:34#0,鍵盤ハーモニク使わないよって言ったら,
Morpheme,185#00:02:36#0,頭おかしいじゃん俺,
Morpheme,185#00:02:37#0,まあね、そう,
Morpheme,185#00:02:38#0,だから急いでその日帰って鍵盤ハーモニク買って,
Morpheme,185#00:02:42#0,急いで指導案作って鍵盤ハーモニクの授業をした,
Morpheme,185#00:02:45#0,こんなね、思い出の鍵盤ハーモニクで音出していきたいと思うんでね,
Morpheme,185#00:02:48#0,第4楽章に入る前に,
Morpheme,185#00:02:51#0,ほんとに軽く第1楽章から第3楽章までを触っておこうと思うんだよ,
Morpheme,185#00:02:55#0,それまで流れたのがあるから,
Morpheme,185#00:02:57#0,第1楽章はもう激しく壮大,
Morpheme,185#00:03:01#0,絶望みたいな曲,
Morpheme,185#00:03:03#0,あー,
Morpheme,185#00:03:04#0,第9の全体のタイトルってなかった?,
Morpheme,185#00:03:07#0,えっとね、公共曲第9番,
Morpheme,185#00:03:09#0,第9番ってところがタイトルか,
Morpheme,185#00:03:11#0,で、なんかたまにその合唱付きっていう風に,
Morpheme,185#00:03:14#0,あーいったいする,
Morpheme,185#00:03:15#0,副題がついてたりする,
Morpheme,185#00:03:16#0,最初が結構絶望より,
Morpheme,185#00:03:19#0,そう,
Morpheme,185#00:03:20#0,こういう暗い和音から始まって,
Morpheme,185#00:03:24#0,またこれに終わるようなね、すごく絶望感のある曲,
Morpheme,185#00:03:28#0,第2楽章、これもね明るくないし,
Morpheme,185#00:03:31#0,なんかね、テンポもすごく早いから,
Morpheme,185#00:03:33#0,落ち着かない曲,
Morpheme,185#00:03:35#0,なんかやだね,
Morpheme,185#00:03:36#0,ちょっとやだよね、ここまで,
Morpheme,185#00:03:38#0,これ大工の話,
Morpheme,185#00:03:39#0,これ大工の話,
Morpheme,185#00:03:40#0,年末にぜひ聴いてほしい大工の話,
Morpheme,185#00:03:42#0,今もうあんまり聴きなくなってきちゃったけどな,
Morpheme,185#00:03:44#0,いやでもこれからこれから,
Morpheme,185#00:03:46#0,第3楽章はね、ゆったりと,
Morpheme,185#00:03:49#0,この世で最も美しい音楽の一つって言われるぐらいの音楽,
Morpheme,185#00:03:53#0,いやいや、言い過ぎでしょ,
Morpheme,185#00:03:55#0,いやいや、これはね言い過ぎじゃないの,
Morpheme,185#00:03:57#0,いや本当に?,
Morpheme,185#00:03:58#0,うん、本当に綺麗だから,
Morpheme,185#00:03:59#0,前回ね、米東弁の苦の人生について見てきたわけなんだけど,
Morpheme,185#00:04:03#0,第1楽章でまさしくね、それが襲いかかってきて,
Morpheme,185#00:04:07#0,第2楽章で不安定なテンポ感に翻弄されて,
Morpheme,185#00:04:13#0,第3楽章でようやく安堵というかね,
Morpheme,185#00:04:16#0,落ち着き、人生の美しさを,
Morpheme,185#00:04:18#0,ああ、知ったなって思えるような,
Morpheme,185#00:04:20#0,そういう流れでここまで来てるよね,
Morpheme,185#00:04:23#0,そこは一応、米東弁になぞらえている?,
Morpheme,185#00:04:27#0,彼の人生に?,
Morpheme,185#00:04:29#0,米東弁は公共曲第5番、運命で,
Morpheme,185#00:04:33#0,暗いところから明るいところへ,
Morpheme,185#00:04:36#0,絶望から希望へっていう流れを確定させていって,
Morpheme,185#00:04:40#0,その流れっていうのは他の作曲者も真似していく,
Morpheme,185#00:04:44#0,伝統的な形式になっていくんだけど,
Morpheme,185#00:04:46#0,今回の第1曲もそれを踏襲していると思ってくれればいいな,
Morpheme,185#00:04:49#0,なるほど、分かりました,
Morpheme,185#00:04:51#0,第3楽章ですっごい落ち着いた気分になったの,
Morpheme,185#00:04:54#0,最後の和音もね、綺麗なのね,
Morpheme,185#00:04:58#0,すごい落ち着いたね、和音なんだけど,
Morpheme,185#00:05:02#0,落ち着いてるよね,
Morpheme,185#00:05:04#0,ああよかったよかったって,
Morpheme,185#00:05:06#0,今もねじんわり伸びてて終わっていくなって思ってた,
Morpheme,185#00:05:10#0,次の瞬間ね,
Morpheme,185#00:05:14#0,ちょっと不快というか,
Morpheme,185#00:05:16#0,なんかね、どうしたっていう,
Morpheme,185#00:05:19#0,さっきの気持ちよさとは一転した和音が,
Morpheme,185#00:05:22#0,フォルテッシュまでいきなり襲いかかってくる,
Morpheme,185#00:05:24#0,あれは歌かねしてる時に出るジャーキング感があるね,
Morpheme,185#00:05:27#0,足びっくらんってなると,
Morpheme,185#00:05:29#0,これあれと似てる,
Morpheme,185#00:05:30#0,冗談じゃなくて、第3楽章ゆったりしてるって大丈夫?,
Morpheme,185#00:05:33#0,寝ちゃうんだよね,
Morpheme,185#00:05:35#0,大抵の人はね、第1楽章聞いて,
Morpheme,185#00:05:38#0,すごいな、第2楽章聞いて,
Morpheme,185#00:05:40#0,早いな、第3楽章聞いて,
Morpheme,185#00:05:42#0,はぁーって寝ちゃうんだよ,
Morpheme,185#00:05:44#0,絶対ね、4分の3まで来たもんね,
Morpheme,185#00:05:46#0,で、ここでごめんなさいって起こされるんだよね,
Morpheme,185#00:05:50#0,これはあるあるだね,
Morpheme,185#00:05:52#0,さっきの仕掛けとしては,
Morpheme,185#00:05:54#0,第3楽章の終わりの音,
Morpheme,185#00:05:58#0,シレファーに1個ラの音を加えた,
Morpheme,185#00:06:01#0,これが,
Morpheme,185#00:06:04#0,こういう作りになってるわけ,
Morpheme,185#00:06:06#0,要はこのラとシのフラットがぶつかる不協和音,
Morpheme,185#00:06:09#0,不協和音をベートーベンは襲われたりしなかったんだけども,
Morpheme,185#00:06:13#0,このね、びっくりする和音,
Morpheme,185#00:06:16#0,これをね、恐怖のファンファーレっていう風に表現してるわけ,
Morpheme,185#00:06:20#0,それは聞き手側にとってってこと?,
Morpheme,185#00:06:22#0,これを表現したのは後のワーグナーっていう作曲家,
Morpheme,185#00:06:26#0,名前だけは聞いたことありますよ,
Morpheme,185#00:06:28#0,あれは恐怖のファンファーレだっていう風に言ったからその名前が残ってるんだけどね,
Morpheme,185#00:06:32#0,ちなみにそれってさ、いい意味で言ってるの?,
Morpheme,185#00:06:35#0,うーんとね、まあそうだね,
Morpheme,185#00:06:38#0,びっくりさせるっていう意味合いで,
Morpheme,185#00:06:40#0,別にけなしてはない,
Morpheme,185#00:06:41#0,なるほどなるほど,
Morpheme,185#00:06:42#0,ちゃんと効果的に働いてますよ,
Morpheme,185#00:06:44#0,そうそうそうそう,
Morpheme,185#00:06:45#0,本当にびっくりするから,
Morpheme,185#00:06:47#0,で、この不恐怖のファンファーレが鳴った後に,
Morpheme,185#00:06:50#0,そこに我らが,
Morpheme,185#00:06:52#0,チェロとコントラバスオですよ,
Morpheme,185#00:06:54#0,もう我らがよ,
Morpheme,185#00:06:55#0,この番組においては,
Morpheme,185#00:06:57#0,みんなチェリストにしてくるから,
Morpheme,185#00:06:59#0,みんなチェリストだから,
Morpheme,185#00:07:01#0,気持ちね、我らがチェロがね,
Morpheme,185#00:07:03#0,今度は否定の旋律っていうのをここにぶち込んでくるわけ,
Morpheme,185#00:07:07#0,否定の旋律?,
Morpheme,185#00:07:09#0,【チェロの音】,
Morpheme,185#00:07:14#0,っていう風な続いていくんだけど,
Morpheme,185#00:07:16#0,もっと続きがあるんだけどね,
Morpheme,185#00:07:18#0,これを否定の旋律って呼んでるの,
Morpheme,185#00:07:20#0,否定、なんか全然イメージと違う,
Morpheme,185#00:07:24#0,そうそう、これがね、なんで否定なのかは後で出てくるかちょっと覚えておいて,
Morpheme,185#00:07:27#0,分かりました、覚えてます,
Morpheme,185#00:07:29#0,これがここに来る意味合いについてなんだけど,
Morpheme,185#00:07:32#0,恐怖のファンファーレが来たよね,
Morpheme,185#00:07:34#0,すごい凄まじい怖い世界がやってきたよね,
Morpheme,185#00:07:37#0,これを取り消してるんだよね,
Morpheme,185#00:07:39#0,あ、なるほどね,
Morpheme,185#00:07:41#0,違うよ、そうじゃないよっていうことね,
Morpheme,185#00:07:43#0,なるほどなるほど,
Morpheme,185#00:07:45#0,で、否定の旋律がその恐怖のファンファーレを打ち消しました,
Morpheme,185#00:07:49#0,すると、なんとびっくり,
Morpheme,185#00:07:52#0,第一楽章の再現が行われるんだ,
Morpheme,185#00:07:56#0,要は、第四楽章って曲が始まってるんだけど,
Morpheme,185#00:07:59#0,第一楽章の全く別のことが,
Morpheme,185#00:08:02#0,第四楽章中に挿入されてるんだね,
Morpheme,185#00:08:05#0,2、3の間を飛ばして1が4に来てる,
Morpheme,185#00:08:08#0,1の部分を切り取って第四楽章の中に入れ込まれてる,
Morpheme,185#00:08:12#0,へぇー,
Morpheme,185#00:08:14#0,どういう意味合いかっていうと,
Morpheme,185#00:08:16#0,この曲全体としてベルトヴェンが歓喜、喜びを探しているんだけども,
Morpheme,185#00:08:21#0,第一楽章の音楽、第二楽章の音楽、第三楽章の音楽を通過して,
Morpheme,185#00:08:25#0,第四楽章に入った,
Morpheme,185#00:08:27#0,そして恐怖のファンファーレがやってきた,
Morpheme,185#00:08:29#0,でもそれじゃない,
Morpheme,185#00:08:31#0,探している歓喜はそれじゃない,
Morpheme,185#00:08:33#0,じゃあ、やっぱりこれでしたか?,
Morpheme,185#00:08:35#0,探し物は何ですか?,
Morpheme,185#00:08:37#0,見つけにくいものですか?って言って,
Morpheme,185#00:08:39#0,第一楽章のテーマがここでやってくるわけだ,
Morpheme,185#00:08:42#0,ちょっとやってきたのと違って言うと,
Morpheme,185#00:08:44#0,イヌフェオスイカンがあったんですけど,
Morpheme,185#00:08:46#0,まあ、だからサングラスをかけてきたのかな,
Morpheme,185#00:08:48#0,そうかもしれないね,
Morpheme,185#00:08:51#0,納得しちゃったけど,
Morpheme,185#00:08:53#0,それは置いといて,
Morpheme,185#00:08:55#0,第一楽章の雰囲気そのまま持ってきて,
Morpheme,185#00:08:57#0,で、どうなるかってことなんだけど,
Morpheme,185#00:08:59#0,また否定の旋律がやってくるんだよね,
Morpheme,185#00:09:02#0,否定された後にまた否定が来るんですか?,
Morpheme,185#00:09:04#0,そうだね、恐怖のファンファーレが来ました,
Morpheme,185#00:09:06#0,否定の旋律が来ました,
Morpheme,185#00:09:08#0,で、第一楽章これですか?って来ました,
Morpheme,185#00:09:11#0,でもそれも否定するんだよ,
Morpheme,185#00:09:13#0,おー,
Morpheme,185#00:09:15#0,今のこれですか?は幸せこれですか?って,
Morpheme,185#00:09:18#0,そうそう,
Morpheme,185#00:09:19#0,歓喜これですか?って,
Morpheme,185#00:09:20#0,探してた歓喜はこれですか?っていうこと,
Morpheme,185#00:09:22#0,じゃあまだこの先があるぞと,
Morpheme,185#00:09:24#0,そうです,
Morpheme,185#00:09:25#0,違うんだよって言ったんだけどね今,
Morpheme,185#00:09:27#0,そしたら否定の旋律が来てね,
Morpheme,185#00:09:29#0,ごめんなさいそれじゃないんです,
Morpheme,185#00:09:31#0,って言ってイヌフェオスさんにはお帰りいただくんですよ,
Morpheme,185#00:09:33#0,そしたら,
Morpheme,185#00:09:34#0,呼ぶだけ呼んでおいて,
Morpheme,185#00:09:35#0,そう呼ぶだけ呼んでおいてね,
Morpheme,185#00:09:36#0,ごめんなさい間違えましたって言って,
Morpheme,185#00:09:38#0,お返すんだけど,
Morpheme,185#00:09:39#0,今度は第二楽章が再現されるわけ,
Morpheme,185#00:09:42#0,だから第一楽章が来て,
Morpheme,185#00:09:43#0,違う第二楽章が再現される,
Morpheme,185#00:09:46#0,要粋さんカムバックねここで,
Morpheme,185#00:09:47#0,それも要粋だね,
Morpheme,185#00:09:49#0,"要粋1,2,3というのかもしかして",
Morpheme,185#00:09:51#0,今度はシャツの色変えてきたから,
Morpheme,185#00:09:53#0,変えてきたのかなんか変えてくるわけ,
Morpheme,185#00:09:55#0,でもそれじゃない,
Morpheme,185#00:09:56#0,それでもない,
Morpheme,185#00:09:57#0,またその要粋は否定されるの?,
Morpheme,185#00:09:59#0,やっぱりその要粋でもないんだね,
Morpheme,185#00:10:00#0,そうなんだ,
Morpheme,185#00:10:01#0,ここでも違うから否定の旋律が来る,
Morpheme,185#00:10:03#0,また来るんだね,
Morpheme,185#00:10:04#0,はいよしお出口はあちらなので,
Morpheme,185#00:10:07#0,ありがとうございました,
Morpheme,185#00:10:09#0,要粋さんそろそろ切れるんだよ,
Morpheme,185#00:10:10#0,ご丁寧に出口までご案内するんだけど,
Morpheme,185#00:10:13#0,そしたらね,
Morpheme,185#00:10:14#0,また要粋さん別の出口からやってくるんだね,
Morpheme,185#00:10:16#0,今度は第三楽章が始まるんだよ,
